,Company,Date,Text
0,Alphabet,2023-11-14,Apple get Google search revenue Safari Alphabet witness say http Google pay Apple third search advertising revenue Safari term two company search default agreement Alphabet witness say open court Monday figure previously know public one clearest indication lucrative Google search deal Apple search engine company incidental disclosure Alphabet expert witness Kevin Murphy professor economics University Chicago expect Google pay Apple third search advertising revenue Safari term two company search default agreement Alphabet witness say open court Monday amid protract antitrust battle Google Department Justice figure previously know public one clearest indication lucrative Google search deal Apple search engine company company fought limit reveal deal detail cite potentially anticompetitive effect incidental disclosure Alphabet expert witness Kevin Murphy professor economics University Chicago expect Murphy testimony come part company effort fight Justice Department claim company illegally maintains dominance search advertising market Williams Connolly antitrust partner John Schmidtlein visibly cringed Murphy reveal number Bloomberg News report search default agreement major focus proceeding Judge Amit Mehta described deal heart case number Wall Street pay attention well Bernstein analyst Toni Sacconaghi estimate note client Apple would see billion revenue result search engine default deal Google Neither Apple Google immediately respond request comment Alphabet CEO Sundar Pichai defend deal testify proceeding Google competitor described arrangement damage business Microsoft CEO Satya Nadella example push back detail testify October Nadella say every year held top job Microsoft dialogue Apple default search engine deal Microsoft Bing even meant billion loss Nothing yet come talk Nadella say Nadella say idea open web misnomer Everybody talk open web really Google web say stand use google search present result understand bing present result feel satisfied immediately perform search google feel satisfied gif hell Microsoft company market cap trillion dollar Google complain Google anticompetitive towards mean window every single PC search go Microsoft create even big monopoly company Big time nothingburger IMO figure previously know public one clearest indication lucrative Google search deal Apple search engine company understand conclusion sure deal lucrative side figure specifically Google web cause Bing absolute garbage Nadella crime mutually profitable Good company top two like Google well Apple ca go wrong own next two Microsoft Amazon Google would high low Makes sense Apple negotiate get paid default user Google search seem right show powerful Apple effectively manage become part everyone life without feel lose case study Apple branding truly one amaze thing business history Oh wow almost browser user clear market collusion benefit american economy nothing go happen american side Google doesnt want apple build search engine advertising competitor apple fine perpetually milk iphone forever make unsuccessful product side sit mountain cash european normally jump gon na best another search engine selection screen everyone choose google europe ever want compete would allow growth advertising startup ala delete search engine neither Microsoft bad bad Google Rather SwissCows Google us apple news Na business usual Please Roast Portfolio Started invest year objective half index ETF Half stock pick hold year mostly fun really enjoy learn value invest still rookie invest would love feedback method look company meet follow criterion gross margin ROIC ROCE insider ownership net margin FCF margin Revenue growth earnings growth stock base compensation preferably operating cash flow look business understand perceive strong moat perform discount cash flow analysis use discount rate exit free cash flow multiple prefer company least year history free cash flow growth calculate expect cash flow growth portfolio Alphabet avg price Adobe avg price Fortinet avg price Microsoft avg price Amazon avg price Mercado Libre avg price Visa avg price ASML avg price DSV avg price DKK LVMH avg price Early return since inception view welcome thank FWIW professional equity PM many many year make share HUGE proponent diversification sake get good company stack growth tech obviously index etf weight way US company large weight index double Maybe make index small cap index rather large cap assume P inside ownership criterion onerous opinion Good luck really admire discipline approach never invest ETF simply stock picker think ETFs though appropriate vast majority people situation glad get international exposure yeah think luxury invest decade thing well small cap material exposure low cost index fund etf recommend one versus another ignorance God damn RKLB today could perfect Almost RKLB fantastic company make almost meta amazon
1,Alphabet,2023-11-15,crazy idea think Google pay Apple want win deal Microsoft want prevent Apple make search engine Otherwise feel weird Apple position make cut since switch Bing would pretty detrimental Apple well Everyone obviously hate Bing Recently many search Google end Bing AI take Bing AI Chat MSFT want replace Google use google anymore quite long time use safari edge care privacy care sanity Apple map well public transportation experience compare Google Msps old news sure want try edge Please try least beg Alphabet pay Apple Safari search revenue Sundar Pichai confirms apple develop search engine Like AppleGPT something Puts Google happens User Report Total Submissions First Seen WSB day ago Total Comments Previous Best DD Account Age http http think Google search pretty well corner would Apple want change get extract massive iPhone tax Google compete Google search boot would extremely costly Apple compete domain whereas right tax google pay basically pure profit Also main way Google make money search advertising outside Apple traditional business model way get privacy conscious continue portray Google FB etc bad guy still find way siphon money Google retain focus core business make valuable company world Google one get raw deal Apple pay huge sum money competitor mobile space reason iPhone user base large loyal wealthy ignore see Satya Nedella testify trial behalf gov Tim Cook one go use apple search Apple map pure shit  User Report Total Submissions First Seen WSB year ago Total Comments Previous Best DD Account Age http http hope cashed need go back one week confident able achieve give level flow vein Show u time champ Rags rich back rag dumpster call Disappointed come Congrats Well do Save uncle Sam guy definitely risk per trade http Yo OP go back Ur great gambler price call bought saw number contract somewhere tire math lol guy regard understand position show sell closing call bought prior day post need break like man next dip two buy call watch trend head downwards LMAO AMC year ago bought car cash lol felt nice Still get car love bit Glad played well lose as spy call always bad possible strike Made today call though bad one truly inspirational man crashed account regrow make breakeven year help inspire may possible get ta hold profit lol fake asf Cant wait img Looks like deposit http bought enough spy share sell call buck im really confuse future play play PPI RKLB million share trade yesterday Insane high volume day ever
2,Alphabet,2023-11-16,Apple horrible search reason try search song Apple Music show everything except song Apple need get Apple hand everybody pocket would Google pay understand power Apple relationship bluff threaten make Bing default search engine news great party keep monopoly Wsb yawn well See Wendy
3,Alphabet,2023-11-18,downside Alibaba keep look Alibaba NYSE BABA since last week way look Alphabet month ago little bad news cloud compute generally profit Price fall whole cloud income seem like exaggeration anything else miss feel like dip panic could get turn around sanity restore week China Yeah man Panic dip dip since end Oct China nobody trust disclosure everyone well aware one comment regulation end instantly Alibaba know well anyone drop two year Jack criticise regulation tech get slap Xi Jack family trust sell mil share next week bottom may Chinese American would trading bare minimum price chinese company different accounting practice rest western world put diplomatically BABA favorite company right bullish anything else people parrot bullshit heard somewhere instead actually try understand thing big company world market cap AAPL produce product China essentially unsigned lease agreement American company exploit China citizen point CCP could anything range implement export tax evict completely Yet forward PE currently nobody even want consider aforementioned downside risk large subset people say invest BABA ChInA exposure AAPL American company way shape form bullshit lazy argument loom delist risk resolve late Yes directly company ADR overvalue People thought experience cloud boost Amazon Amazon China Jack related shit initially cause fall recently weak Chinese economy opinion fact BABA still grow weak economical period China incredibly bullish economy get well time growth substantially increase tandem country whole unfathomable growth potential BABA benefit Additionally invest significantly tech beyond cloud business enormous amount untapped growth potential sector play card right PE Forward PE respectively Simply put already make shit ton money use FCF aggressive share buyback recent ER also announce annual dividend personally care last point reinvest big naysayer claimed China would never let foreign investor extract actual value company TL DR Yeah course risk true every investment BABA shit ton good thing compensate risk expect quick reversal share price play China downside trust China truthful disclosure People bring China big obstacle probably correct still think worth gamble put bit plan hold long time know maybe Amazon like rise time maybe China seizes think future upside could turn least double worth risk small portion portfolio people say China Pinduoduo another Chinese company trading price free cash flow compare BABA trading market put nearly multiple one Chinese ecom company another chinese econ company Yes China connection hurt BABA Chinese company explain Take PDD grow faster BABA though BABA still excellent growth PDD growth come mostly international segment segment expose many regulatory political risk well PDD dependent US market BABA much diverse exposure world market BABA issue growth come low margin business concern US trade war hurt BABA internal CCP regulation crackdown hurt PDD risk valuation discrepancy believe market belief Alibaba underlie business model weak pricing company PDD go eat Alibaba lunch long future China Wednesday low even though state change avoid country wonder fact ca get chip screw Huawei make cloud rather sell chip Baba others say China long story Alibaba belongs list company industry allow foreign investor Chinese government want full control industry mainly education tech medium healthcare BABA many others industry try bypass play around illegal VIE structure buying cayman island company stock call BABA contract receive profit real Alibaba company China entire thing mercy China government point decide contract hold left nothing mean China risk Probably change nothing fact stock like BABA essentially real ownership unless China government change policy unlikely Even could also go way lose value confirmation illegitimacy China stock structure therefore warrant far high discount take position Baba stock make information widespread hence discount apparent However stock like PDD honestly warrant discount still price high atm Love Baba Perfect time get long term put Cash flow go little transition undervalue similar Meta drop much upside Meta like downside percent upside Chinese expect stock go vast majority big money player comfortable allocate fat amount capital buying shit simple supply demand little demand Chinese stock people trust people dont believe report number history cooked book Maybe narrative change one day everyone start buying Go ahead risk money bet want pay big know non Chinese bet also pay lol people bother buying China stock Alibaba Chinese government control org senior CCP member board call shot CCP want use Alibaba extend control population deliver profit shareholder trust Chinese government org especially trust whatever say report know current Alibaba CEO kidnap government right happen Jack Alibaba previous CEO founder company make money doesnt mean shareholder
4,Alphabet,2023-11-19,wish CDRs Chinese stock Canada could load Alibaba instead shitty etf chinese overall market bullish Alibaba stock eventually Amazon Walmart killer order Aliexpress time ever since Amazon screw horrible customer service steal money year ago zero issue package take less week reach Canada cost less Amazon product minus big brand sell Ali moment Alibaba go rule world point opinion go cut amazon walmart dollar store etc equation real threat trade war China import restrict west ca without cut throat unlikely happen ton cash low debt love buy ton stock probably DCA though since could go low recession long term like stuff like Telsa Bitcoin term growth potential
5,Alphabet,2023-11-20,ZM earnings today card Zoom Video Communications ZM release stuff today get see fare recent quarter Wall Street expect report earnings per share Revenue billion slight increase prior year quarter company report billion Zoom forecast January fiscal year call revenue billion billion adjust profit share Consensus estimate call revenue billion earnings share coronavirus emergency company share price rollercoaster lad talk cutthroat competition growth hit brake kicker Zoom get ta level corporate jungle want keep revenue game strong company seek grow move beyond flagship web meeting service add software contact center webinars chat email plus new artificial intelligence AI tool among thing growth remains slow stock retreat far year Nasdaq shoot amid buzz generative AI technology Today Zoom likely post quarter revenue growth plus side Zoom Video billion cash balance sheet sit treasure chest boy expect acquisition research note preview quarter Morgan Stanley analyst Meta Marshall drop knowledge research note stock likely move much investor feel confident company online business small customer flock platform pandemic Marshall play chill Equal Weight Zoom Another key question Marshall mention Zoom fresh toy might spur reacceleration company enterprise business also wonder Zoom might use strong balance sheet make strategic acquisition mention earlier Zoom billion cash investment equal market capitalization Important Factors Zoom fiscal performance likely gain steady demand product like Zoom Video Webinars Zoom Rooms Zoom Phones expand portfolio solution expect aid customer growth quarter company AI related advancement partnership fiscal third quarter noteworthy Zoom adopts federate approach AI utilize exclusive AI model well model renowned AI company like OpenAI Anthropic quarter ZM threw generative AI digital assistant mix Rather increase revenue Zoom Video expect AI tool retain customer annual Zoomtopia user conference early October company say charge customer use AI Companion right dish FREE Zoomers paid account Talk power move totally expect key growth driver capability include summary smart recording conference company announce new platform innovation leverage robust AI capability aim simplify workday provide efficient communication collaboration tool Zoom Video race build artificial intelligence tool business communication platform Zoom Video recently back change term service platform user would enable gather data train AI model Set release Docs workspace use documentation project track management task Meanwhile recently told employee report office regular basis Amid emergency demand Zoom videoconferencing software surge business told employee work home Also Zoom morph social phenomenon make video call become routine consumer keep touch family friend Remote learn need telemedicine also boost demand Zoom Video service availability Zoom Clips allows user easily record edit share video message internally externally likely aid enterprise customer growth quarter company also announce launch Notes fresh workspace design create collaborate meeting Zoom Video aim integrate AI product Enterprise Connect conference March Zoom Video announce expansion workplace collaboration platform Called Zoom IQ summarizes chat thread organizes idea draft content chat email whiteboard session creates meeting agenda May Zoom announce investment AI startup Anthropic support research roadmaps Anthropic AI model integrate Zoom Contact Center platform Zoom Video July roll Zoom Workforce Management improves agent productivity agent work shift monitoring agent performance consensus estimate enterprise customer fiscal third quarter currently pegged One key Zoom success freemium business model Zoom basic package free put limit number participant group call length meeting Zoom software get high rating ease use simplicity follow earlier video service provide jerky image audio company freemium business model help win customer rapidly later convert pay customer fiscal second quarter customer contribute revenue trail month grow customer account revenue quarter momentum expect continued quarter number likely well Zoom Meeting refers videoconferencing session host cloud infrastructure Paid Zoom business plan cost per employee require minimum seat Zoom Phone product roll let customer set group internet phone call without video Zoom Phone replaces traditional business PBX phone system Zoom reach million paid phone seat end say Baird Power company expect become revenue segment early year perhaps high future However company face significant competition like Cisco Microsoft Google Meet might lead loss small business customer likely hurt growth let talk competition specifically Microsoft Sales growth slow quarter company adjusts slow product demand emergency era See left wonder decelerate sale hit bottom Zoom software set video call chat tool available Also customer easily share content Microsoft Teams communication tool pretty much offering Zoom major rival business market Microsoft upgrade product technology startup OpenAI company early March say company President Greg Tomb former cloud compute executive Alphabet Google leave also mention cut job workforce coronavirus crisis eas retain small business well corporate account one key Zoom success customer one employee renewal expect slow economy reopens order lift expect less turnover large customer business market Zoom rival include RingCentral RNG Cisco Systems Google others Growth annual recur revenue business customer contract top one metric monitor July Zoom Video FIVN automates call center service announce deal merge deal originally value billion company terminate agreement Zoom Video aim player contact center market product service earnings last year share average move earnings regardless direction Options currently pricing move tho go consider lotto play grab call believe really time turn thing around AI usage increase customer base earnings bad simply go crash low enough put profitable However expecations pegged call might move Keep mind like post financial advice like show people type stuff tend look try attempt earn play hopefully help future earn play Later week NVDA impressively good call minute go market back fuck yer call fuck yer put time anyone us zoom anymore fire bunch people Calls zoom Zoom like one ex keep try level corporate jungle let real never successful MSFT http WEAK earnings Revenue flat operating margin LOWER last quarter buyback announcement PUTS Looks like call move lot earnings exceed expect move past month briefly come back start screw call put ZM option need move beyond range Otherwise house option seller general winner experience follow bother trading week holiday bother trading day fed chair talk Looks like Zoom use billion cash buy new friend corporate world instead fix shoddy AI Good luck swim revenue sinking product ZM ZM http Microsoft team webex future Even MOMO know top ten holding Mormon Church billion portfolio Apple AAPL Microsoft MSFT Alphabet GOOGL Nvidia NVDA Amazon AMZN UnitedHealth Group UNH Meta META Mastercard Exxon XOM Tesla TSLA convince join church
