,Company,Date,Text
35,McDonald,2023-12-08,hit need get fuck back desk chair wage slave nobody leave big Google fan boy pixel smart phone Biggest position portfolio freely admit marketing suck many product lackluster data quantity quality fuck valuable make product struggle add strength AI advancement find right csuite officer company potential large planet surprised video Gemini pretty incredible watch One huge advantage Google own YouTube much data access nobody else Okay Bard Pixel user make Nano less powerful Make answer question answer wrongly Buy bag meh trust Google AI like trust North Korean leadership Nobody care Google claim certainly want Google AI life bunch thing related Gemini HUGE one fact Google apparently Gemini completely silicon training also inference give Google huge competitive advantage competitor Google competitor stuck pay Nvidia tax Google really big deal inference aspect LLMs Wonder go found pretty fake Looks like Alphabet take AI next level Gemini Ca wait see Ultra Nano Pixel Pro Fancy CAVA DECEMBER SHORT PLAY Potential Crash Death Spiral personal thesis base research perhaps much OVERVIEW CATALYST CAVA Group CAVA own operates chain around Mediterranean restaurant company offer salad dip spread topping dressing sell product whole food market grocery store company also provide online food order service Cava Group found base Washington DC company successful IPO Shares open apiece NYSE nearly double IPO price Cava sell million share offering raise around million However IPO Lockup Period Expiration happen next week huge amount insider share become available trade thinly recently average trade stock tax benefit one want hold bag many early investor likely realize relatively quick profit initial share sell cheaper Every time involve situation investor would HODL never work even Everything get dumped second becomes possible investor try realize profit minimal number buyer stock might enter free fall Also institution would want come much low level interfere Eventually stock find floor expect much low price point possibly range specifically chosen Jan put give play breathing room VALUATION IMO every measure company currently overvalue last quarter revenue million negative net income company current free float valuation stand ratio CAVA expect revenue EBITDA margin net income margin best would make company everything go perfect end next year would equate future initial IPO hype dy stock peak around seem continuously trend similar Sweetgreen start IPO around couple year ago get way recover current Ironically Sweetgreen SG found also Washington DC trajectory repeat Chipotle success even unlikely multiple reason include Product Competition section Portfolio manager Artal Group Rowe Price Swan Hospitality Revolution Growth Capital International Investors major CAVA shareholder well company principal control ten million share total trip offload least portion holding sure like see stock dwindle price range create temporary death spiral bring price quickly PRODUCT COMPETITION personally Carnivore several month counting feel much well study Carnivore diet great detail every day past month listen hundred lecture read thousand testimonial blatantly clear eat completely wrong whole life overwhelm amount data show Carnivore least Ketovore way eat continuously share research family closest friend meat help lot resistance process Carnivore movement gain popularity expect major shift base healthy choice animal product outlet restaurant chain Please check thousand video lecture interview YT Drs Anthony Chaffee Shawn Baker Ken Berry many others see could one important decision family say source grind grill season meat fish ensure quality nutrition However travel occasionally buy dish Chipotle QDOBA Shake Shack McDonalds Burger King food chain restaurant would strip carbs vegetable consume ideal suffices Carnivores would agree mean twice per month meal look CAVA menu found nothing Carnivore would find appropriate human consumption let alone anything healthy dish contain chicken typically bird consider barely eat cardboard Carnivore world typically kept horrible condition fed absolute often GMO garbage include cut bird multiple stomach cow process modify food properly technically still consider meat carry marginal nutritional value item include carbs convert sugar sugar feed cancer vegetable thousand various toxin none ancestor ate significant quantity chain restaurant particularly great stretch imagination either least find meat fish must eat CAVA would least favorite choice read many review people reaction mixed price quality CAVA food seemingly negative positive Like many place fight uphill battle Rebranding radically opposite diet would work well either Furthermore chain somewhat similar offering top hundred thousand general restaurant every corner price particularly great margin quite thin like restaurant CONCLUSION expect bloodbath next week stock already start crack sugar coat Taj Van Wilder seem appropriate quote Questions comment welcome POSITIONS CAVA put consider short CAVA share TL DR Become Carnivore buy Jan put CAVA short CAVA share NIO Inc Undervalued NIO undervalue lot people take look daily weekly chart go back begin NIO IPO see stock rise buck drop way price today buck like point thing maybe consider give right amount weight evaluate NIO potential growth case believe NIO undervalue keep simple focus big piece believe make NIO unique business long successful lifespan ahead spar pain reading hundred detail point simply think mention feature would easy digest quick NIO clear achievable vision NIO vision focus around sustainability place lot focus show business model action example NIO dealership network sell car via app interior car include recycle water bottle also involve green initiative Sanjiangyuan area Furthermore member UNGC United Nations Global Compact NIO research development already paid continue NIO developed ability swap deplete car battery minute something Tesla either consider able car NIO developed stylish technologically advanced feature AI assistance integrate dashboard along state art exterior sensor enable AI drive NIO car offer one two drive mode nine Ultimately NIO diverse pool talent span world NIO R department Silicon Valley Beijing Copenhagen many place NIO talent span across globe company benefit greatly differ perspective culture NIO big strength problem may arise opportunity solve multiple kind people different background tackle issue NIO consider improve business model ultimately profit NIO think play idea separate battery business entity well financial situation would amaze company do McDonalds create Chipotle Ebay spun PayPal bought big company do NIO car price sell average price car amaze look feature spec car absolutely beautiful car price reasonably opinion Teslas outdated comparison know NIO profitable NIO new company literally start nine year ago young innovative refresh company much potential wait see go wait see NIO convince receive positive review Lucid Motors extremely expensive Rivian also expensive poorly design Tesla yet demonstrate innovation production ability let finish summarize state NIO undervalue NIO great company clear vision focus provide modern beautiful technologically advanced AI intelligent car everyone wealthy NIO stock price hit floor show sign bull run grown last week nobody see current price NIO steal bullish NIO bet NIO next year Wish luck Thanks reading User Report Total Submissions First Seen WSB year ago Total Comments Previous Best DD Account Age http http TL DR NIO great company currently undervalue clear vision diverse team talented individual car price reasonably bullish NIO believe stock price increase next year NIO bag holder agree NIO undervalue think people underestimate company potential ability innovate Chinese stock worth gon na hijack discussion rivian NIOs battery swap plan flaw best could implement country due theft vandalism concern Plus uncomfortable stick dick Pooh bear honey far much risk government interference never buy trash meaningful number share former nio bag holder nah ev market saturate China visit right least south see single nio byd xpeng Let go bag NIO valuation useless NIO chinese thus party feck investor anytime want NIO chinese book cooked get share ADR say NIO share give exposure guarantee whatsoever McDonald create chipotle fund financially goal always divest McDonald never say http Elmo rid Xi real hard NIO chance without commie party put Tesla gulag go swappable battery stupid Elon vision go supercharger Easiestly one pivotal decision EV industry clearly understand people would buy battery swap enable car thing human logical emotional u dude statistic stock trading u problem emotionally physically handle fast charge cable tiny little woman see feminine emotionally wield big rigid heavy sometimes dirty charge cable want battery swap sit car fully automatically minute anybody know relationship woman know something mean pay thing even though make absolutely logical sense aspect Time would woman like supercharger minute home minute earlier kid back ask home woman think think think would sure nice kid could home house instead sit blue bubble iPhones thing pay girl care NADA technology need new iPhone Pro Max sale Model literally explode woman saw woman family buy Buying product emotional decision car make family sign big purchase decision family problem woman need experienced supercharger cable situation minute charge session need know experience battery swap THATS Nio big problem point IMO regard talk feature feeling Glorious CCP Position share feel like hot swap battery HUGE boon ev concept doesnt seem catch could standardise battery unmanned swap station space every cover entire world nobody ever run power Hell probably restock fleet robot drive self drive car entire energy distribution backbone touch free fully automate could manage current technology there way shit go formalise single battery standard ev Maybe eu year EV race China price war factor think make people sell stock Li auto suv BYD Tesla tell truth avg per share Imagine diamond like bag Heavy img also bag holder im sorry bag buddy Lmfao NIO fun lose money  Could use like paragraph weird meat diet fuck According exist shareholder own total outstanding share paid average Top shareholder alone own company likely sit profit http Cava Contracts PDS Looking DKS Like Spiral everyone think slam dunk sure load put Jan anyways look exit early CAVA DECEMBER SHORT PLAY Potential Crash Death Spiral personal thesis base research perhaps much OVERVIEW CATALYST CAVA Group CAVA own operates chain around Mediterranean restaurant company offer salad dip spread topping dressing sell product whole food market grocery store company also provide online food order service Cava Group found base Washington DC company successful IPO Shares open apiece NYSE nearly double IPO price Cava sell million share offering raise around million However IPO Lockup Period Expiration happen next week huge amount insider share become available trade thinly recently average trade stock tax benefit one want hold bag many early investor likely realize relatively quick profit initial share sell cheaper Every time involve situation investor would HODL never work even Everything get dumped second becomes possible investor try realize profit minimal number buyer stock might enter free fall Also institution would want come much low level interfere Eventually stock find floor expect much low price point possibly range specifically chosen Jan put give play breathing room VALUATION IMO every measure company currently overvalue last quarter revenue million negative net income company current free float valuation stand ratio CAVA expect revenue EBITDA margin net income margin best would make company everything go perfect end next year would equate future initial IPO hype dy stock peak around seem continuously trend similar Sweetgreen start IPO around couple year ago get way recover current Ironically Sweetgreen SG found also Washington DC trajectory repeat Chipotle success even unlikely multiple reason include Product Competition section Portfolio manager Artal Group Rowe Price Swan Hospitality Revolution Growth Capital International Investors major CAVA shareholder well company principal control ten million share total trip offload least portion holding sure like see stock dwindle price range create temporary death spiral bring price quickly PRODUCT COMPETITION personally Carnivore several month counting feel much well study Carnivore diet great detail every day past month listen hundred lecture read thousand testimonial blatantly clear eat completely wrong whole life overwhelm amount data show Carnivore least Ketovore way eat continuously share research family closest friend meat help lot resistance process Carnivore movement gain popularity expect major shift base healthy choice animal product outlet restaurant chain Please check thousand video lecture interview YT Drs Anthony Chaffee Shawn Baker Ken Berry many others see could one important decision family say source grind grill season meat fish ensure quality nutrition However travel occasionally buy dish Chipotle QDOBA Shake Shack McDonalds Burger King food chain restaurant would strip carbs vegetable consume ideal suffices Carnivores would agree mean twice per month meal look CAVA menu found nothing Carnivore would find appropriate human consumption let alone anything healthy dish contain chicken typically bird consider barely eat cardboard Carnivore world typically kept horrible condition fed absolute often GMO garbage include cut bird multiple stomach cow process modify food properly technically still consider meat carry marginal nutritional value item include carbs convert sugar sugar feed cancer vegetable thousand various toxin none ancestor ate significant quantity chain restaurant particularly great stretch imagination either least find meat fish must eat CAVA would least favorite choice read many review people reaction mixed price quality CAVA food seemingly negative positive Like many place fight uphill battle Rebranding radically opposite diet would work well either Furthermore chain somewhat similar offering top hundred thousand general restaurant every corner price particularly great margin quite thin like restaurant CONCLUSION expect bloodbath next week stock already start crack sugar coat Taj Van Wilder seem appropriate quote Questions comment welcome Positions x CAVA put consider short CAVA share Fidelity Jan put http TL DR Become Carnivore buy Jan put CAVA short CAVA share hip brother get put load since last week beautifully laid im go buy put
36,McDonald,2023-12-09,Sorry mcd need AI chatbot thought real Carnivore part lol end sure insider gon na dump share big thread WSB actually think compelling case make bought put week common stock drop bit lockup expiration unique give valuation low margin restaurant chain growth stock find unlikely make big move Worst case much movement predict next week sell put small loss Best case tank worth note IPO price would agree person say much low would lucky actually like food one near u always empty service still somehow shit expect death spiral sub price seem likely However word caution someone net short lot always hard predict price already high cost short recently create bit run cost borrow remain elevate could still see something similar repeat next week PCR show bearish reading certainty either see big short Finaly keep mind market seem value overvalue rubbish differently nowadays look CVNA MSTR SAVA AI name see lockup expiry take chunk stock also see lot time anticipation overblown nothing happens Usually one crater IPO blatant cash underlie enterprise pretty clearly expose hollow early month public Insiders flee exit whatever get CAVAs overprice dish thing know still popular trendy grow sure fit model concept expose empty rise seem overdone maybe fat trim kind glaze populist diet fad stuff ever say actual insider lockup number could see relative scale versus trading float etc Everyone aware lockup come possible risk banking price already delete heard lot anyone actually eat place buy call think CPI data come next tuesday could effect price short term bullish im pretty new trading expiration would prevent suppose remember time stock lock period expire people sell Rivn last year free money glitch delete sell quite end December call upcoming share release expect stock start dive much week though certainly pleasant surprise look stock Puts ready Similar post common thing opposite Lol
37,McDonald,2023-12-11,thesis correct bullshit valuation dog shit continue slide downward opinion weird as carnivore discussion HOWEVER sure hope dingleberries jumping understand imply volatility theta cause get crush investor half brain control sell panic sell like retail trader OP head screw stay farther expiration stay ATM high delta Anyone source lockup date late get put look good IMO insider able sell lockup
38,McDonald,2023-12-12,Well go thought delete like must love time double dingleberries Average pussy Feeling bad one bought put exp course buy go moon thanks universe Bought another put img Bought drop right RiGHt Folks silverlinings shareholder squeeze motivate take profit importantly also bought put low avg RSI hit consider Lets wait guy sell Diamond hand regard assemble Talk squeeze Waiting dump haha age well Stock today wild think would
39,McDonald,2023-12-13,McDonalds Coffee someone tell new coffee chain part McDonalds chain Meaning buying McDonalds share buying new chain well entity may one day public offering like buy Roth part MCD buy share MCD effectively buying exist business new one moment new coffee chain part McDonalds corporation buying McDonalds stock buying coffee chain runaway success maybe spin know opening store next year buying strictly Cosmc concept store hyped news know go incredibly small experiment McDonald everywhere amount total location worldwide new growth plan add location add USA next five year mind plan Cosmc experimental location location something move financial needle say new concept succeed McDonalds impact stock large decade treat breakfast nuisance excuse pile physically impossible ever scale CEO come saw way expand sale window dramatically mandate relatively easy change need operationalize also take seriously make efficient productive overlap strategy sale window become hour company stock performance go parabolically McDonalds version low footprint coffee donut shack popular town take something might eventually impact Moot point since likely bite dust epic fashion like Arch Deluxe McPizza Onion Nuggets debacle http Cofvee part McDonald Even get much big time doubt would get spun really see new restaurant last sustain power beverage market already saturate know answer really buying individual stock Stick index fund mccafes across world guess drive sure well opening McDonald coffee drink Oh already buy MCD past year coffee chain Hard say sure point guess McDonald would want keep least partial ownership branding purpose spinoff well Franchising model could give upside without much risk full spinoff Keeps option open guy think ozempic go mainstream would significantly impact fast food company Lol checked price RIP
40,McDonald,2023-12-14,Imagine Hot coffee serve McZog Coffee Hut drive thrus law suit shall proliferate fester like piece McNuggets Costing much leave bad taste mouth McFools write without help Chat McDLT Thanks response Thoughts MCD Hey team Wanted opinion McDonalds vast portfolio stock index fund nothing focus high dividend pay say think acquire MCD sweet Thoughts Welcome beginner advice brokerage info book recommendation even advanced topic please read Wiki http wonder stock move certain way check Finviz http aggregate news almost every stock also see Reuters http even Yahoo Finance http Please direct simple question towards stickied Daily Discussion Quarterly Rate Portfolio thread sort Hot top Also include due diligence http post may remove low effort bot action perform automatically Please contact moderator subreddit question concern employee call quit supervisor Wendy one problematic employee kid full charity case diversity hire might adult mental age year old ticked nearly every box learn mental disability bad struggle believe human full regard every sense word know somehow manage operate till think height modern technology much think Wendy global tech giant take Apple Anyway want try relate thing little bit well know interested market talk short Apple time make difference ensure Wendy outperforms interest rate decision go make sudden thing shout oh shit side may may embezzle money Wendy may may say understatement may may short BTC obviously Ponzi say long keep secret long enough hit jackpot go OTM option know eventually collapse happens best way profit virtually free pay million logical Anyway freak figure get fire right need HRs approval tell suddenly mumble random incoherent mess quits honestly relieve longer deal secret safe fire guy pay wipe thing bottom sh t never like guy funnily enough one want wipe people Problem though thing hiding behind dumpster back shop try ambush try call police since trespass get go away keep tell offer good time code tell know make bet BTC use Wendy money hindsight actually think smart enough know probably overreaction still paranoid anyone able provide advice thing need invest advice get control Edit think employee might also active come across post appear http Please nice little bit special User Report Total Submissions First Seen WSB year ago Total Comments Previous Best DD Account Age http http http http Wendy get Goodwill make Wendy Supervisor Honestly think describe Get ball checked gynecologist Shit post fine img could pimp employee good time give wristy keep difference secret instead tell HR quit tell change bank account give one set separately pocket hard earn money say know buy seaside holiday home investment property send kid private school plead ignorance sip pina colda tropical island retirement fails try pay hush money pray god go public read letter Santa write year old make sense whatever shit Rainbow bear Care bear even sure fly fuck read make laugh hysterically Im sure room perform side hustle behind wendys dumpster way u img img Sir Wendy Well do sir supervisory management skill brilliant investment strategy post Maybe ur highly regard LMAO work bald chance look permanent cocaine high eye surname Cramer YTA man order might want cut back snort frosties
