,Company,Date,Text
0,Tesla,2023-12-07,Magnificent Rotation year November Magnificent contribute around P growth rest obviously lot talk rotation P riskier name think scale contribution pretty crazy Market Value Gained January November Microsoft Apple Nvidia Amazon Alphabet Meta Tesla company P total Market Value Gained November December Apple Tesla Amazon Meta Microsoft Nvidia Alphabet company P total Makes sense index successful hot stock index think mega cap tech oversold fair value currently GOOGL individual stock majority VTI enough confidence sector healthcare energy consumables etc make bet otherwise last year felt confident bought GOOGL definitely see future year allows significantly growth company like Alphabet Microsoft Ford Exxon may wrong risk buying individual stock rather total market approach Especially consider tech strength current relatively high interest rate environment also allows possibility significant appreciation rate cut reason also contribute earnings growth mean rest market catch Considering good earnings surprising contribute lot index compose company go pull index Last year contribute decline index article info loser p year hear winner Would consider classic Kramer move Google sell HOOD rally like Toyota sell Tesla rip prove big tech big car company mean good invest User Report Total Submissions First Seen WSB week ago Total Comments Previous Best DD Account Age http http Tesla share March img Crazy idea know move Robinhood season consolidation seem delete prof tech nerd make good investor believe ask FTX SBF Caroline Ellison Elon Musk go Disney CEO Bob Iger say http http Elon Musk let beef Disney CEO Bob Iger X bos trash Iger Thursday write X http formerly Twitter fire immediately Walt Disney turn grave Bob do company Musk pounce news New Mexico attorney general sue Meta http CEO longtime Musk rival Mark Zuckerberg lawsuit alleges Meta social network enough protect kid Instagram Facebook safe space child rather prime location predator trade child pornography solicit minor sex accord AG Raúl Torrez One user X point Disney still advertising Meta company recently pull ad X http Musk support antisemitic post http Musk chime http misspell Disney CEO name Bob Eiger think cool advertise next child exploitation material Real stand guy another user ask Iger fire yet Musk reply fire immediately also respond news headline call Iger fire one word truth Musk immediately respond request comment ahead publication Musk late attack advertiser flee platform New York Times Dealbook summit Musk succinct vulgar response company want give money anymore Go fuck http event Musk take opportunity single Iger clear Musk ask hope Hey Bob Earlier summit Disney CEO ask company decision pull advertising X know Elon large life many respect name much tie company either found own whether Tesla http SpaceX X Iger say Iger appear reference Musk decision boost antisemitic tweet last month take position take quite public manner felt association position Elon Musk X necessarily positive one u Iger say Musk face onslaught criticism http post X call antisemitic post absolute truth Though Musk later appear walk back original comment call foolish Iger Disney one many Musk take aim year billionaire publicly diss several major figure company include Apple http President Joe Biden http Nothing fun business drama folk look comment please remember trading forum please try relate comment back trade make plan make make etf Disney Tesla Someone gon na win battle properly hedge etf solves problem Look ticker symbol CUM want shame Elon take Twitter remain public could make fortune trading put Elon endorse DeSantis gang Disney anyway yawn richest man planet butthurt Mickey Mouse company advertising Twitter happen master plan make Twitter people force buy blue checkmarks Never bet mouse moron either bipolar drug problem One day go sure leave stop advertising platform fuck like give shit next get mostly one side flame war people told leave like god damn year old edge lord even one real friend intervene love true free market capitalism way actually face free market capitalism Old man yell cloud Says guy drove Twitter cliff Imagine run marketing large corporation make choice whether advertise twitter Knowing large contingent user hate Elon outright would probably look upon give money know ever decide pull advertising might receive personal retaliation Elon dead end Elon dipshit point accept Elon mentally ill less cringe dumb kid Holy shit wall street bet ai Glad Elon sure help Tesla past year Wait nevermind complete ghost Must nice avoid duty still get paid Bob Eiger think cool advertise next child exploitation material Real stand remember guy lift suspension user post child pornography X http Elon love outrage culture war left Lol Musk look Meta get sue think thing happen Xitter tantrum even Donald trump would envy feel like Elon intentionally try strawman motivation advertiser leave platform weirdly pathetic really know anything Bob Iger well company world famous right wing troll contribute around P growth co year till time User Report Total Submissions First Seen WSB year ago Total Comments Previous Best DD Account Age http http AmaSon second graph Whoever built chart full blown regard img surprised market well since November consider woke start make money sure everyone else jealous success growth represent increase SPY Nov today damn gain porn Leave bunch reguards miss Santa key bump Yall User Report Total Submissions First Seen WSB year ago Total Comments Previous Best DD Account Age http http per day get ta bump number rookie number Shares today hold lever tech Thought gain porn big percent gain delete whole percent Wow really make helluva play sport Let know get hot stock tip bucko qqq tqqq tqqq play Nasdaq WSB Anyway Gainz make Loss Porn thing matter Option long term recur invest stock like Apple Tesla tech automotive company realize ETF well long term option Opinions Cancel AAPL ARKK monthly put extra personally doubt arkk cancel ark appl put qqq want tech exposure know like vxus id personally put vti voo Arkk cancer Dumb question monthly buy AAPL work get fractional share Take arkk go real casino instead VIG VYM Magnificent Rotation year November Magnificent contribute around P growth stock combine Since rotation name quite significant
1,Tesla,2023-12-08,Buffett choose business next year listen Buffett interview lot may listen well ask question diversification classic Buffett fashion reject whole ideology behind diversification university finance course teach prudent principle diversification Personally agree stuck principle long time Berkshire allocation apple right say never need business make extremely wealthy get economic condition interested hearing pick business entire portfolio would pick confidently Tesla Berkshire portfolio Apple publicly trade portfolio ton private business Buffet Lynch well diversify Focusing investment small amount company build wealth need good lucky last long enough build wealth use strategy reason buffet leave wife P index Wants listen list Tesla lol Microsoft Apple Google listen shareholder meeting Coincidentally listen today well chance answer question diversification take dig diversification say protection ignorance tongue cheek lot people diversification make sense go time skill locate company Even WB question talk great company one mention dexter shoe Read turn even wb make mistake sure anyone else see way number time one mag recommend thread bit disconcert also say best investment make investment Apple Costco Google amd google nvidia could pick would want follow criterion profitable strong moat show profitable reliably ca sure durability might around year room growth beat market even P good return high ROIC ROCE strong balance sheet valuation make sense mind would pick follow one railway currently reasonably price strong moat tailwind onshoring pricing power probably around year pick UNP like new CEO CNI CP would next pick Adyen trade Amsterdam work industry year one even come close low cost one pricing power Since build everything efficient competitor mess Pristine balance sheet Probably top managment world load range still undervalue imo Eurofins ERF trade Paris test sort IP switch scale moat ROCE Great managment exellent capital allocation Ca really replace AI technology Bonus pick like SCHW EvolutionAB EVO Stockholm borse NU Holdings taxable IRAis Amazon Im happy see path year much sooner Microsoft best perform stock since bought wish bought Im happy everything else etf single stock first feel like Tesla another correction next year Im gon na buy lot Amazon maybe Microsoft VT chill crowd get trigger kind talk LOL Apple tsmc jp morgan company Apple AAPL One best company exist Opinion love product along hundred million people around world make almost unbelievable margin good company come close cover tech consumer good well enough Ares Capital ARCC provide diversity invest private market several thousand company good history good reputation provide reasonably stable return decent job cover mid cap tilt towards medical expect continue grow diversified properly stable return Eaton ETN current employer huge multinational company hand ton different industry great reputation good company work operates lot industry invest money capture new business space becomes accessible commercial Covers manufacturing multiple industry tech speculative venture R research etc three large position NVDA AMZN META probably substitute NVDA V love NVDA valuation would want little conservative ten year heavy concentration Also company well way make money V Blackberry Kodak Enron Ca AAPL one carry Covid interest rate come retiree look add dividend stock PFE SCCO COP SPG F ABBV another growth stock AMAT make money past balance rest equity allocation VOO Probably good next year SoFi Buffet ever say need stock know AAPL even BRK big hold BNSF well revenue track UNP CP SPGI SOFI MSFT UNH Call tinfoil hat want think sell offs actually one thing make rally happen maker end get position big enough make pump worthwhile might even pumped company capitulate really blame Kinda like ARK sell NVDA rally Kramer would bought low brag Jerry go lose CEO arrest fraud mean Cramer community info like stock NEGG Options year DCA stock PE RATIO like almost brainer late Microsoft bail Apple million investment today would worth something like billion think Google survive blunder magnitude Yeah reason think fine without see earnings well world would Robinhood become competitor Google HOOD garbage company anyone trade deserves rope account NIO Inc Undervalued NIO undervalue lot people take look daily weekly chart go back begin NIO IPO see stock rise buck drop way price today buck like point thing maybe consider give right amount weight evaluate NIO potential growth case believe NIO undervalue keep simple focus big piece believe make NIO unique business long successful lifespan ahead spar pain reading hundred detail point simply think mention feature would easy digest quick NIO clear achievable vision NIO vision focus around sustainability place lot focus show business model action example NIO dealership network sell car via app interior car include recycle water bottle also involve green initiative Sanjiangyuan area Furthermore member UNGC United Nations Global Compact NIO research development already paid continue NIO developed ability swap deplete car battery minute something Tesla either consider able car NIO developed stylish technologically advanced feature AI assistance integrate dashboard along state art exterior sensor enable AI drive NIO car offer one two drive mode nine Ultimately NIO diverse pool talent span world NIO R department Silicon Valley Beijing Copenhagen many place NIO talent span across globe company benefit greatly differ perspective culture NIO big strength problem may arise opportunity solve multiple kind people different background tackle issue NIO consider improve business model ultimately profit NIO think play idea separate battery business entity well financial situation would amaze company do McDonalds create Chipotle Ebay spun PayPal bought big company do NIO car price sell average price car amaze look feature spec car absolutely beautiful car price reasonably opinion Teslas outdated comparison know NIO profitable NIO new company literally start nine year ago young innovative refresh company much potential wait see go wait see NIO convince receive positive review Lucid Motors extremely expensive Rivian also expensive poorly design Tesla yet demonstrate innovation production ability let finish summarize state NIO undervalue NIO great company clear vision focus provide modern beautiful technologically advanced AI intelligent car everyone wealthy NIO stock price hit floor show sign bull run grown last week nobody see current price NIO steal bullish NIO bet NIO next year Wish luck Thanks reading User Report Total Submissions First Seen WSB year ago Total Comments Previous Best DD Account Age http http TL DR NIO great company currently undervalue clear vision diverse team talented individual car price reasonably bullish NIO believe stock price increase next year NIO bag holder agree NIO undervalue think people underestimate company potential ability innovate Chinese stock worth gon na hijack discussion rivian NIOs battery swap plan flaw best could implement country due theft vandalism concern Plus uncomfortable stick dick Pooh bear honey far much risk government interference never buy trash meaningful number share former nio bag holder nah ev market saturate China visit right least south see single nio byd xpeng Let go bag NIO valuation useless NIO chinese thus party feck investor anytime want NIO chinese book cooked get share ADR say NIO share give exposure guarantee whatsoever McDonald create chipotle fund financially goal always divest McDonald never say http Elmo rid Xi real hard NIO chance without commie party put Tesla gulag go swappable battery stupid Elon vision go supercharger Easiestly one pivotal decision EV industry clearly understand people would buy battery swap enable car thing human logical emotional u dude statistic stock trading u problem emotionally physically handle fast charge cable tiny little woman see feminine emotionally wield big rigid heavy sometimes dirty charge cable want battery swap sit car fully automatically minute anybody know relationship woman know something mean pay thing even though make absolutely logical sense aspect Time would woman like supercharger minute home minute earlier kid back ask home woman think think think would sure nice kid could home house instead sit blue bubble iPhones thing pay girl care NADA technology need new iPhone Pro Max sale Model literally explode woman saw woman family buy Buying product emotional decision car make family sign big purchase decision family problem woman need experienced supercharger cable situation minute charge session need know experience battery swap THATS Nio big problem point IMO regard talk feature feeling Glorious CCP Position share feel like hot swap battery HUGE boon ev concept doesnt seem catch could standardise battery unmanned swap station space every cover entire world nobody ever run power Hell probably restock fleet robot drive self drive car entire energy distribution backbone touch free fully automate could manage current technology there way shit go formalise single battery standard ev Maybe eu year EV race China price war factor think make people sell stock Li auto suv BYD Tesla tell truth avg per share Imagine diamond like bag Heavy img also bag holder im sorry bag buddy Lmfao NIO fun lose money  JPOW look job data today http User Report Total Submissions First Seen WSB year ago Total Comments Previous Best DD Account Age http http Yall miss Santa rally Dude portfolio shit ton begin Mostly bulltards wsb quiet bit http Yep long Meta Zzzz show graph platform Boring gain porn missionary position gain porn gain Get boomer rich as wallstreetbets boomer Show u weekly gain gtfo broker Reminds TD Show u time img way make first million stock base asset allocation risk management make million first place please share genuinely ask top heavy mean great company worried fail definitely worth keep position price maybe bit expensive go total market RSP good Equal weight ticker Looking Simplify IRA Hey guy look streamline Rollover IRA portfolio would appreciate advice attach screenshot current holding goal make portfolio manageable efficient maintain balance growth income risk love accomplish thing Diverse mix stock bond alternative Interested growth income generation Looking reduce complexity without sacrifice performance open suggestion consolidate remove strategy could simplify portfolio Thanks advance http Seems like place selection First thing achieve desire growth income risk understand whats category Growth easy quantify opinion growth suggestion personally PRWAX FOCPX FBGRX SCHB consistently beat P disclaimer overlap holding income go JEPI JEPQ SCHD VPU VZ mix stock well AAPL MSFT LLY NVO MRK GOOGL BRKB OC TSM AMZN JPM stay away anything least beat P year period except income suggestion like international fund rather ADRs good company meet criterion recently move cash holding BIL get yield market cool bit buy weakness portfolio one like SCHD TSLA AAPL Use site check selection P like use FXAIX VOO Hope help least think approach http analysis
2,Tesla,2023-12-09,lifetime pdt ban gon na kill robinhood Pushing user away except well  see bull nasdaq think fine approach ARKK little speculative may want go Russell EFT instead Apple best run company world reason think continue although BRKB give major exposure Apple well may want dial extremally lucky extremally delusional super new trading stuff hop reality check start demo trading first time today account end day mainly trade popular stock apple amd tesla google seriously wonder get lucky something right im genuinely curious hope seriously properly hesitate go comment hard make win trade hard make win trade consistently unlucky win like get start trade beginner want lose keep lose every single trade Winning beginner cost arm leg later really ask return day lucky ask risk portfolio every day Perhaps question master Daytrading single day first two trade make k well Robinhood less lol Proceeded lose butt year figure crap careful able trade high price stock account every month year say luck make money day SPY make new high year lose money today would say hang never come back day easy others need consistency hundred trade really say know Lol day old demo trader extremally lucky extremally delusional Paper trading useless simulate important thing get real trading slippage partial fill order queue inability reset account free locates platform delay emotion etc hey start trading real account try replicate able stay discipline year care people say go bust time something stupid like short stock rally start instead lose hundred buck might acceptable tuition teach nearly easy look backtesting make sure strategy work longer period time make sure fool thing would real trading else invalidate backtest prove edge stroke luck try Rinse repeat profitable play anymore similar many endeavor take life Consider luck friend profitable bump begin common think Give good month start feel like superman chart Good luck good easy money go large rid Lambo time get mad skill sell everything wealth month Lucky Markets change way trading could continue work everyday next day suddenly thing change red red day one good day extremely lucky one good week lucky one good month good chance luck whole year lucky year lucky say profitable trader told post make short today ready keep demo trading genius put real money Luck Dude say make grow account try real trading real lose wo make difference life get day like today every month market establishes direction morning continue direction day may want see little longer time frame luck Things usually different mind trade real money feel every dollar move posture change Try real life could ignore feel consistently congrats natural aptitude trading rest u negotiate every day option
3,Tesla,2023-12-10,might blockade Tesla affect company operation reputation consider expansion plan Scandinavian region Tesla trouble labor union Scandinavia deepen lose legal action Sweden postal service refusal deliver license plate electric vehicle giant postal service worker block Tesla license plate delivery late last month show solidarity mechanic strike company refusal sign collective bargaining agreement employee customary Sweden Tesla take legal action CEO Elon Musk brand move insane Swedish court rule Thursday PostNord force deliver license plate Teslas legal battle swedish postal service Postnord ongoing side case happen Tesla ask temporary decision get plate case ongoing get high court reverse decision Tesla v postal service case ongoing sub deviate away talk stock talk politics ffs post striker negative get downvoted oblivion sub pump trash like intel hard take seriously Teslas reputation Europe take nosedive musk expect significantly low potential sale future scar away prime customer base political Unions view much favorably public way important car brand EV brand pop everywhere Scandinavia enough money replace tesla want Scandinavia big market unless spread rest EU concern buy little market inevitably overreact company reputation fall comment Musk mean pretty stupid try fight union EU Musk need change European car maker applaud side line would EU state understand Elon move Scandinavia first place Labour crazy expensive union extensively entrench politics society whole nothing European US labour European Elon gtfo Europe asap simply viable produce EU business perspective striker number low triple digit maybe might impact dont think people buy tesla care thing striker whatnot battling Neither Musk care angle lawsuit beyond doesnt care Northern scandinavia small market hurt Tesla end Atleast reputation wise people aim get Tesla aftermarket consider twice one sell cant get rid Tesla sell model Swedish car market worldwide sale give Tesla various struggle insignificant would imagine add wish kind solidarity USA lol Meh tesla already mobile service maintenance Easy fix Kinda dumb folk union side hostile cash rich vertically integrate company political take long game strategy get want Dane Tesla cave company Nordics Hopefully cave much operational damage think damage sale much outside strike People buy car base feature price Caring Tweets CEOs buying car thing drive car via land border sale lose Negligible would say affect mostly Sweden Swedish economy exactly great Swedish currency low government own postal service deny service client base disagreement completely separate topic investor entrepreneur would absolutely stay away country communist like tendency volvo toyota skoda need tesla big concern Scandinavian small market anyway probably affect Tesla nearly badly Cybertruck fiasco Overall Tesla valuation continue battery company car company anyone buy buy accordingly Tesla either force sign contract force exit market Musk win one existential Nordic way life Selling woke product exploit labor become richest man suprises sell car remove ARM Thanks suggestion take deep dive
