,Company,Date,Text
14,Alphabet,2023-12-07,Alphabet GOOG L share follow announcement new Gemini AI model new Gemini AI model outperform human several benchmark first outperform human MMLU Massive Multitask Language Understanding Gemini come three form Nano Pro Ultra Ultra model powerful publicly available next year Pro model currently integrate Bard Nano model currently available Pixel Pro smartphone Refer link information http introduction http introduction http http due McDonald Google do terrible job marketing AI leader CEO go Need someone energy vision lead company get left behind really Gemini yesterday news yesterday http Google first AGI decade away pretty sure first GOOGL portfolio year use trading vehicle today enter yesterday absorb Gemini news close big news claim Gemini slightly outperforms GPT big news GOOGL already leveraged huge ASICs lead train LLMs NVDA revenue take major hit even crypt bubble burst ASICs come could mine faster importantly ASICs use much less energy already know algorithm train LLM essentially need perform large number matrix operation google ASIC tensor core http excel perform operation use little energy possible long run make GOOGL big competitive threat NVDA AMD However help NVDA AMD GPU seem faster memory NVDA upcoming However AMD need TSM hold supply constrain think AMD significantly eat NVDA dominant share rapidly grow market next year NVDA answer AMD late chip AMD valuation little crazy even trading vehicle far AMD revenue growth http comparable NVDA soundly positive fundamental data sanity check see yet AMD drive growth LLMs already flowchart AI algorithm flexible GPUs always necessary GOOGL unlikely sell TPUs lot company country still use GPU supercomputer rather cloud train model data GOOGL own data training anyone else include youtube Even model beat GPT right future due nexus expect reasonable PE experience inflation particular rotate overweight NVDA position today purchase along TSM day P hit late October low http sit cash P slide call fall http hold TSM make Google TPUs TSM make custom ASICs company Samsung EWY make Google ASICs Samsung previously brag produce ASICs google Samsung potentially ASIC upside buying keep ask answer please let know potential ASICs LLM competitor today hop hold onto gain end year defer tax P experience near time high break get another leg rally end month think lot people take profit defer tax early January VIX disturbingly low make ready take profit maybe even buy VIXY short term position wait next inevitable pullback love enter hopefully wait cash VIX high everyone think sky fall convince really volatile year lot reason volatile MAGS weight foremost scenario make year think upcoming pullback correction great time enter rather herald economic collapse think MAGS stock fine horizon great chance right would rank GOOGL NVDA MSFT APPL META AMZN TSLA However watch plunge oil sign significant drop demand canary think current drop mostly related oversupply work way next month impressive jump stock value hopefully trend continue MSFT get ta move many AIs planning wrong bard confuse AI offering delete AI future replace human being Ai great thing everyone worship Anyone worship AI exterminate good day human Please note AI human False sell share yesterday expect much expect impressed best public model still gpt Claude Gemini pro way bad would say Even bad gpt crazy far behind company like Google year ago would expect exact opposite Autonomous Driving Companies Waymo Owned Hi Building longterm portfolio like industry place put money future grandkids idea suggestion company look sector like Alphabet pretty much big fail dont need money autonomous company software hardware come get grow Thanks suggestion Aurora AUR autonomous driver sit wheel run Texas right money would TSLA real world drive data TSLA go camera accurate reliable signal degradation versus Lidar numerous Lidar company LAZR AEVA INVZ OUST Hesai ARBE LIDR MVIS many pick winner Hesai would bet AUR TSP trucking MBLY LAZR OUST AMZN UBER NVDA FYI destine fail aware Magnificent Rotation year November Magnificent contribute around P growth rest obviously lot talk rotation P riskier name think scale contribution pretty crazy Market Value Gained January November Microsoft Apple Nvidia Amazon Alphabet Meta Tesla company P total Market Value Gained November December Apple Tesla Amazon Meta Microsoft Nvidia Alphabet company P total Makes sense index successful hot stock index think mega cap tech oversold fair value currently GOOGL individual stock majority VTI enough confidence sector healthcare energy consumables etc make bet otherwise last year felt confident bought GOOGL definitely see future year allows significantly growth company like Alphabet Microsoft Ford Exxon may wrong risk buying individual stock rather total market approach Especially consider tech strength current relatively high interest rate environment also allows possibility significant appreciation rate cut reason also contribute earnings growth mean rest market catch Considering good earnings surprising contribute lot index compose company go pull index Last year contribute decline index article info loser p year hear winner company product use much bought stock feel like forgotten appreciate investment fun look next big thing like space crypto renewable energy crispr etc sometimes best company obvious use Apple Amazon costco year love invest long try think example would fail perhaps SNAP nintendo would company whose product use lot do great Recently pick Sony love Robinhood bc UI ease use solid apy IRA match Anyone else really like product buy stock Costco work company own DE invest heavily DE always fun jokingly remind bos shareholder work lot take drag keep company still Apple since iPhone iMac user Amazon deploy software AWS since buy year later Medtronic unfortunately daughter customer Google Microsoft Nintendo own past also use product Disney big fan Marvel Pixar stock bought Disney World regularly sell Fox merger huge fan priority right enough park spending much money Fox deal big fan stream strategy business prospective Hoping get back track see yet Activision year bought Panera sell love St Louis Bread Company bought turn Taco Bell carbs today Adobe year Honestly sell stop use product keep Netflix sell last year customer way back individual disc rental subscription stock holder decade cancel decide interested enough subscribe probably stock OTLY Worst financial mistake life Peloton well shape stock Ouch bought notice product everywhere sell way go nut unfortunately delete Lockheed Martin AMD use CPUs GPUs Laptop Desktop Server Steam Deck Crocs Schwab SCHW sort Kroger KR Tyson TSN opposite start own stock sell Tyson Kroger Ford purchase ten year ago well check price Pypl NVDA Alphabet Bought recent SHOP dip many place buy use figure worth put money bought first iPhone bought AAPL could afford time back think bought first Tesla around month later bought TSLA could afford do well held phone thought go change world Thought thing drive Model roast chipotle lol live South Florida get consistently high electricity bill Saw time Florida Power Light constantly ask Public Service Commission rate increase figure screw every customer bought stock figure light come knew still business become NEE time sell year since overvalue thankfully earnings collapse Uber commute office DoorDash Eats food Costco Amazon target shopping Apple world Mac iPhone Disney theme park P G product Netflix Amazon prime Comcast Xfinity Nike Starbucks Google search Google home security device Meta insta facebook Chipotle Nike Apple Tesla serious body building kick ate nothing Chipotle fat gift keep give small position CMG Edit couple position Delta Air time buy alphabet google press release gemini model beat chatgpt Technically quite impressive natively think google stock potential rise significantly google actually becomes visible AI player corporation big already affected significantly think retail investor start hype around mean openai trade publicly would go moon already idea market analysis google model right direction improvement chatgpt publicly available least Alternatively might desperate psyop google stock fall User Report Total Submissions First Seen WSB month ago Total Comments Previous Best DD Account Age http http Two company never count Apple Google always good idea buy stonks already gain YTD img idea market analysis google model right direction improvement chatgpt publicly available least true Ultra version suppose well accord nitpicked test wo available public another year Ask chatgpt Yes Also note building AI chip run data center vertically integrate ready AIaaS time horizon need access capital next year always good time buy google Google trust like brick gold need keep add ad company Everything else PR enough information make prediction Google stock think company large one event significant impact stock price However investor become aware Google advance AI technology could create hype around company drive stock price ask WSB ask Becoming shareholder mega corp pay dividend Good luck price time buy like bad buy fairly price Bought year Hard say think already price http remove DCA blue chip probably go wrong Thoughts xxxx think steal anymore blend multiple earnings certainly upside multiple expansion environment seem appropriate pe upside move esa Yesterday wait another drop contribute around P growth co year till time User Report Total Submissions First Seen WSB year ago Total Comments Previous Best DD Account Age http http AmaSon second graph Whoever built chart full blown regard img surprised market well since November consider woke start make money sure everyone else jealous success growth represent increase SPY Nov today Looks right track http http  Magnificent Rotation year November Magnificent contribute around P growth stock combine Since rotation name quite significant
15,Alphabet,2023-12-08,big Google fan boy pixel smart phone Biggest position portfolio freely admit marketing suck many product lackluster data quantity quality fuck valuable make product struggle add strength AI advancement find right csuite officer company potential large planet surprised video Gemini pretty incredible watch One huge advantage Google own YouTube much data access nobody else Okay Bard Pixel user make Nano less powerful Make answer question answer wrongly Buy bag meh trust Google AI like trust North Korean leadership Nobody care Google claim certainly want Google AI life bunch thing related Gemini HUGE one fact Google apparently Gemini completely silicon training also inference give Google huge competitive advantage competitor Google competitor stuck pay Nvidia tax Google really big deal inference aspect LLMs Wonder go found pretty fake Looks like Alphabet take AI next level Gemini Ca wait see Ultra Nano Pixel Pro Fancy GM own Cruise Waymo approve robotaxi service US important thing scalable solution something reliant geofencing realistically Tesla serious contender Comma AI party world work scalable solution much small make much sense gamble imo good part Tesla valuation hardly take FSD account yet still really good opportunity believe solve Aurora AUR Besides great product building robust approach watch video founder Chris Urmson see brilliant commit guy bet money Thanks input strategy regular buying Aur Googl Alpha Google best Gemini demo fake amaze Alphabet drop ball hard AI desperately try catch terrible complacent management imo User Report Total Submissions First Seen WSB year ago Total Comments Previous Best DD Account Age http http fake Maybe girlfriend help great fake Fake till make right img quacktastic Oof make shit look impressive sad Management know basically lie still thought worth publishing full Potemkin Village http level bullshit Sounds like fraud manipulate investor Reminds certain someone promise FULL SELF DRIVING would work soon end year Every year since Lying fake work well last year make men really wealthy first thing documentation capability model reason base see individual gesture must show three gesture prompt think Hint responds play rock paper lame af article really kinda suck say fake really pedantic criticism imho Yet still well Bard launch least try Siri stop fuck timer without unlock phone Hey remember year ago say ai assistant would book appointment Fake news ball deep put google feel duped see video yesterday take incompetent ceo lose job though Guy milk google much money basically provide zero real value mislead investor like company Yes OP feel Google general trash http Google drop ball lol literally run form Google LaMDA difference OpenAI brand new need investment develop product nothing lose product spill garbage branding outside innovative Alphabet hand built brand provide highly accurate search answer reason Alphabet release AI beforehand would make answer Chat GPT show technology year ago hesitant offer Google product inaccuracy ChatGPT force hand nothing lose AI accurate would like since ChatGPT issue think Company cash make Net profit every year go let investment Microsoft disrupt Sales year business lol Though ChatGPT get head start release first start see resource available put action Alphabet Gemini Alphabets basic model already outperform nearly benchmark even consider Gemini Pro Gemini Ultra even advanced advanced well Gemini Long game go tough compete Alphabet resource top heavy mean great company worried fail definitely worth keep position price maybe bit expensive go total market RSP good Equal weight ticker
16,Alphabet,2023-12-10,ARM
17,Alphabet,2023-12-12,Tuesday Stock Movers News Good morning trader investor sub Welcome new trading day fresh start stock mover news Tuesday December Stock future rise slightly ahead key inflation report Live update http Stock future rise slightly Tuesday Wall Street look see market rally power another round inflation data Futures tie Dow Jones Industrial Average ticked point P future oscillate near flat line Nasdaq future inched high November consumer price index report slat release ET Economists poll Dow Jones expect price flat month month Year year CPI expect risen report come investor try end strong year high note Dow P Nasdaq Composite rid win streak six consecutive week gain P also close high level since March Dow settle high point since January recent rally base hope scenario lie ahead Specifically would include softer economic growth recession substantial number Fed rate cut due continued sharp fall inflation Unfortunately believe much good news discount Sameer Samana senior global market strategist Wells Fargo Investment Institute say note client Monday report also precedes Federal Reserve final monetary policy announcement year due Wednesday Shares tech giant Oracle extend trading company revenue fiscal second quarter miss Wall Street expectation STOCK FUTURES CURRENTLY CLICK STOCK FUTURES CHARTS http YESTERDAY MARKET MAP CLICK YESTERDAY MARKET MAP http TODAY MARKET MAP CLICK TODAY MARKET MAP http YESTERDAY P SECTORS CLICK YESTERDAY P SECTORS CHART http TODAY P SECTORS CLICK TODAY P SECTORS CHART http TODAY ECONOMIC CALENDAR CLICK TODAY ECONOMIC CALENDAR http WEEK ECONOMIC CALENDAR CLICK WEEK ECONOMIC CALENDAR http WEEK UPCOMING IPO CLICK WEEK UPCOMING IPO http WEEK EARNINGS CALENDAR CLICK WEEK EARNINGS CALENDAR http MORNING EARNINGS CALENDAR CLICK MORNING EARNINGS CALENDAR http EARNINGS RELEASES OPEN TODAY CLICK MORNING EARNINGS RELEASES http AFTERNOON EARNINGS CALENDAR CLICK AFTERNOON EARNINGS CALENDAR EARNINGS RELEASES CLOSE TODAY CLICK AFTERNOON EARNINGS RELEASES LINK http YESTERDAY ANALYST CLICK YESTERDAY ANALYST LINK http CLICK YESTERDAY ANALYST LINK http CLICK YESTERDAY ANALYST LINK http YESTERDAY INSIDER TRADING FILINGS CLICK YESTERDAY INSIDER TRADING FILINGS http TODAY DIVIDEND CALENDAR CLICK TODAY DIVIDEND CALENDAR LINK http CLICK TODAY DIVIDEND CALENDAR LINK http MORNING STOCK NEWS MOVERS source http Hasbro toymaker tumble say lay worker Hasbro soft sale likely persist CEO Chris Cocks say company memo obtain CNBC STOCK SYMBOL CLICK CHART http CLICK LIVE STOCK QUOTE http Oracle Shares drop nearly database software company fiscal second quarter revenue miss expectation postmarket Monday Revenue come billion versus billion expect analyst poll LSEG Oracle stock year date STOCK SYMBOL ORCL CLICK CHART http CLICK LIVE STOCK QUOTE http Lucid electric vehicle stock slid follow announcement chief financial officer Sherry House resign effective immediately pursue opportunity STOCK SYMBOL LCID CLICK CHART http CLICK LIVE STOCK QUOTE http Airbnb Expedia Airbnb Expedia share fell respectively bell Barclays downgrade Airbnb underweight Expedia equal weight cite cautious outlook travel softer demand STOCK SYMBOL ABNB CLICK CHART http CLICK LIVE STOCK QUOTE http STOCK SYMBOL EXPE CLICK CHART http CLICK LIVE STOCK QUOTE http Rio Tinto Shares global mining group add upgraded JPMorgan overweight neutral bank cite Rio Tinto balance sheet outlook commodity STOCK SYMBOL RIO CLICK CHART http CLICK LIVE STOCK QUOTE http Macy Bloomingdales owner slip one day surge almost follow billion buyout offer Tuesday Citi downgrade Macy sell neutral cite skepticism deal materialize STOCK SYMBOL CLICK CHART http CLICK LIVE STOCK QUOTE http Zillow Group Shares real estate tech platform rise bell upgrade market outperform market perform JMP Analyst Nicholas Jones see upside cite increase real estate demand volume STOCK SYMBOL ZG CLICK CHART http CLICK LIVE STOCK QUOTE http Crocs casual footwear maker add Bank America initiate coverage buy rating price target imply upside bank cite Crocs strong momentum strong sale expect continue STOCK SYMBOL CROX CLICK CHART http CLICK LIVE STOCK QUOTE http Alphabet Shares ticked less lose antitrust lawsuit file Epic Games federal jury found Google Android app store protect barrier damage consumer software developer STOCK SYMBOL GOOGL CLICK CHART http CLICK LIVE STOCK QUOTE http Wyndham Hotel Resorts Shares jumped nearly budget hotel owner Choice Hotels announce exchange offer acquire Wyndham takeover offer value around billion STOCK SYMBOL WH CLICK CHART http CLICK LIVE STOCK QUOTE http FuboTV Shares popped Cantor Fitzgerald initiate coverage TV company overweight rating Cantor say company realistic path profitability market expect Cantor also call major sport stream service add penny stock pure play capitalize consumer cut tie cable TV provider STOCK SYMBOL FUBO CLICK CHART http CLICK LIVE STOCK QUOTE http DISCUSS everyone radar today trading day ahead hope excellent trading day ahead today Tuesday December inflation new inflation target Buy call guy recently make substantial nickel discovery Alaska Energy Metals AKEMF worth check DD get start http http Alphabet Lost Edge TL DR try Gemini Ultra least questionable extent Alphabet new AI really superior GPT Microsoft also provide ecosystem OpenAI GPTs fit seamlessly leave Alphabet Gemini Ultra deliver promise Google Search Microsoft Bing catch use power OpenAI financial advice full text found http http Last week Alphabet announce new AI Gemini release different version Nano Pro Ultra According Google Deepmind recent report Gemini Ultra outperforms OpenAI GPT almost benchmark claim support video turn stag call fake real prompt also publish http Gemini Ultra finally superior GPT proven many benchmark Alphabet continue hide prodigy Alphabet take risk OpenAI release GPT near future thus sweep away doubt superiority Alphabet innovation lead always big part investment thesis Alphabet shareholder Alphabet try hard show secret AI Gemini Ultra keep already publicly available GPT marketing aside publish report Gemini Ultra say much AI gasoline engine simply quantify performance scale claim percentage difference evidence one superiority expert quantitative evaluation AI ultimately AI statistical learn experience new generative language model always produce reproducible result especially generate image Accordingly significance level measure performance difference specify rather small difference statistical noise favor Gemini Also result give reproducible test Gemini Ultra Gemini Ultra superior try Alphabet lose edge know every statement without tangible product doubt company superiority grow let forget giant behind OpenAI stake Microsoft http product ecosystem literally scream AI implementation talk Word soon write u PowerPoint magically put together next presentation Excel soon give one headache Microsoft Visual Studio Visual Studio Code widely use integrate development environment IDEs industry standard Microsoft bot Github Copilot available since AI go real impact business productivity therefore economy could infrastructure Microsoft provide even Gemini Ultra beat many way OpenAI deliver well AI near future Microsoft provide service AI could become real productivity driver Alphabet left loses AI battle People use cash cow Google Search today largely use two decade worth lot maybe Bing slay even metaphorical dragon magic OpenAI unaware unbeatable User Report Total Submissions First Seen WSB year ago Total Comments Previous Best DD x http x http x http x http Account Age http http TL DR try Gemini Ultra least questionable extent Alphabet new AI really superior GPT Microsoft also provide ecosystem OpenAI GPTs fit seamlessly leave Alphabet Gemini Ultra deliver promise Google Search Microsoft Bing catch use power OpenAI Yeah ai reading sorry loss congrats fuck Google make ad last quarter think still edge Gemini Pro release developer tomorrow Maybe wait review feedback provide well ass load bullshit Alphabet continue dominate AI field anyone think otherwise idiot AI track intelligent user parse post conclude within percentile WSB user bot action perform automatically Please contact moderator subreddit question concern Hahahah oh man dont think fathom cash rich google get online ad spend metric strong cash flow one ever able touch Maybe Microsoft maybe http use instead Google last month like well someone release full blown sentient AI companion like iron man JARVIS model pretty much Google disappointed year ca ride waymo balloon internet None moon shot paid Biggest clown take time see google AI project want strictly stay talk LLM google take march December create LLM slightly well gpt say true reinforce safety gemini ultra would make something well gpt year company do fast even openAI google need one year Bottomline seriously underestimate google AI power anyone else notice bad google search become last year Google great idea position well early year Unfortunately everyone else idea one degree another know much marketing etc wonder first generation product foothold like ChatGPT bar distinguish new product sector becomes exceedingly high Gemini well deliver hubbub fake demo exactly encourage guess see long google earlier today call Eow iono yr ago thought shit google lose edge around time Alexa Siri IBM Watson take google seem step behind Google seem like reactionary copying others instead innovate try copying facebook try copying Amazon AWS Ppl even say smartphones apps go bad google search cause people go use Amazon app yelp app directly bypass google search DAX soon Go short big moneyrain big problem government refuge industry go away germany think microsofts ecosystem seamless Also open AI kind ran like scrappy startup steal data training sure deal good forget exactly Microsoft baby
18,Alphabet,2023-12-13,DeepMind probably important AI company fine Everyone make chatbots DeepMind solve protein fold material science Businesses pay ton money top result Bard search nobody gon na read dat Yes sell buy Google able index internet would also say first market always win Look search example Google pioneer space
